{
    "Change of Control Voting Block Threshold": "50%",
    "Company Legal Form": "S Corporation",
    "Company Name": "Legalese Pte. Ltd.",
    "Governing Law Jurisdiction": "Singapore",
    "Investor Name": "Michaelmas Moneypants",
    "Purchase Amount": "$10,000",
    "Purchase Date": "today",
    "Time Notice is Effective after Deposit in the Mail": "30 days",
    "Valuation Cap": "$100,000,000",
    "Equity Financing Purchase Price Threshold": "79%"
}
